{
  "title": "Sunset Serpent",
  "author": "Ashley McNamara",
  "githubHandle": "ashleymcnamara",
  "description": "The classic engine in a warm dusk palette: an amber snake and a rose-red apple over a toasted-cocoa board. Same rules, slower burn.",
  "createdAt": "2026-07-04",
  "tags": ["warm", "chill"]
}
