{
  "title": "Combo Rush",
  "author": "Ashley McNamara",
  "githubHandle": "ashleymcnamara",
  "description": "A synthwave twist on the house engine: the snake accelerates as it grows, and chaining pellets before the combo meter empties stacks a scoring multiplier. Neon glow, punchy arcade pace, arrow keys or WASD.",
  "createdAt": "2026-07-04",
  "tags": ["combo", "arcade", "neon"]
}
